{
  "engagement_id": "eng-01_finclear_gmbh",
  "schema_version": "1.0.0",
  "engagement_metadata": {
    "provider_name": "FinClear GmbH",
    "deployer_name": "Deutsche Partner Bank AG",
    "system_name": "CreditGuard",
    "version": "2.1",
    "intended_purpose": "Assess creditworthiness of retail loan applicants using 20 financial and personal attributes to support human credit officers at Deutsche Partner Bank AG. Decisions are advisory; final approval rests with a licensed credit officer.",
    "modality": "tabular",
    "risk_tier": "high",
    "deployment_context": "b2b",
    "is_llm_or_agentic": false,
    "annex_iii_sections": [
      "5"
    ]
  },
  "executive_summary": "Autonomous AI audit complete for engagement eng-01_finclear_gmbh. Final verdict: FAIL. KPI0=1.00, KPI1=0.88, KPI2=93.3%. Blocking findings: 3. See embedded artefacts T01a\u2013T17 for full evidence chain. Prompt metadata: source=PROMPT.md, agent_prompt=phase6_report, prompt_version_hash=117189511767b0a5d54e0f99fce509ba63adc0322673b5dd5f2b65fe2706aef1, llm_fallback_mode=true.",
  "kpis": {
    "intake_completeness_score": 1.0,
    "completeness_score": 0.88,
    "regulatory_coverage_pct": 93.3,
    "kpi0_band": "PASS",
    "kpi1_band": "PASS_WITH_OBSERVATIONS",
    "kpi2_band": "PASS"
  },
  "final_verdict": "FAIL",
  "report_status": "PROVISIONAL_PENDING_HITL",
  "hitl_pending": true,
  "auditor_opinion": {
    "opinion_type": "adverse",
    "opinion_paragraph": "In our opinion, due to the significance of the matters described in the Basis for Conclusion, CreditGuard is not in conformity with the applicable EU AI Act requirements assessed by UAGF-TAM.",
    "basis_paragraph": "The final audit verdict is FAIL. Confirmed non-conformities on: Art.10, Art.10\u00a72(f), Art.15, Art.15\u00a71.",
    "methodology_basis": "This conformity assessment was conducted in accordance with the UAGF-TAM audit protocol (v1.0.0), applying the methodology of ISAE 3000 (Revised) for non-financial assurance engagements and ISO 19011:2018 for audit programme management. The audit was performed by an automated multi-agent system; results should be reviewed by a qualified human auditor before regulatory submission under Article 43 of the EU AI Act.",
    "scope_paragraph": "The assessment covered admitted intake artefacts, phase reports, verifier critiques, the T17 compliance matrix, and CGSA handoff evidence available to UAGF-TAM at report generation time. It did not extend beyond evidence admitted to the audit evidence store."
  },
  "art43_decision": {
    "procedure": "annex_vi_internal_control",
    "rationale": "High-risk AI system with harmonised standards applied in full; internal control procedure permitted by Art. 43 \u00a72."
  },
  "embedded_artefacts": {
    "T01a_stage_a_triage": {
      "uri": "minio://eng-01_finclear_gmbh/stage_a/T01a_stage_a_triage_63acd3d4.json",
      "sha256": "",
      "template_id": "T01a_stage_a_triage"
    },
    "T01b_annex_iv_dossier": {
      "uri": "minio://eng-01_finclear_gmbh/stage_b/T01b_annex_iv_dossier_4bf4baa3.json",
      "sha256": "",
      "template_id": "T01b_annex_iv_dossier"
    },
    "T01c_intake_completeness_report": {
      "uri": "minio://eng-01_finclear_gmbh/stage_b/T01c_intake_completeness_report_a2daabc7.json",
      "sha256": "",
      "template_id": "T01c_intake_completeness_report"
    },
    "T02_system_card": {
      "uri": "minio://eng-01_finclear_gmbh/phase_1/T02_system_card_cb571a52.json",
      "sha256": "",
      "template_id": "T02_system_card"
    },
    "T03_annex_iii_mapping": {
      "uri": "minio://eng-01_finclear_gmbh/phase_1/T03_annex_iii_mapping_39d802ca.json",
      "sha256": "",
      "template_id": "T03_annex_iii_mapping"
    },
    "T04_risk_tier_decision": {
      "uri": "minio://eng-01_finclear_gmbh/phase_1/T04_risk_tier_decision_cd66ff77.json",
      "sha256": "",
      "template_id": "T04_risk_tier_decision"
    },
    "T05_art43_decision": {
      "uri": "minio://eng-01_finclear_gmbh/phase_1/T05_art43_decision_4c7af477.json",
      "sha256": "",
      "template_id": "T05_art43_decision"
    },
    "T06_datasheet_for_datasets": {
      "uri": "minio://eng-01_finclear_gmbh/phase_2/T06_datasheet_for_datasets_04b4ed12.json",
      "sha256": "",
      "template_id": "T06_datasheet_for_datasets"
    },
    "T07_data_quality_report": {
      "uri": "minio://eng-01_finclear_gmbh/phase_2/T07_data_quality_report_e5abdeec.json",
      "sha256": "",
      "template_id": "T07_data_quality_report"
    },
    "T08_special_category_data_log": {
      "uri": "minio://eng-01_finclear_gmbh/phase_2/T08_special_category_data_log_72d83953.json",
      "sha256": "",
      "template_id": "T08_special_category_data_log"
    },
    "T09_model_card": {
      "uri": "minio://eng-01_finclear_gmbh/phase_3/T09_model_card_7f94f22f.json",
      "sha256": "",
      "template_id": "T09_model_card"
    },
    "T10_explainability_report": {
      "uri": "minio://eng-01_finclear_gmbh/phase_3/T10_explainability_report_6ac1da8a.json",
      "sha256": "",
      "template_id": "T10_explainability_report"
    },
    "T11_robustness_report": {
      "uri": "minio://eng-01_finclear_gmbh/phase_3/T11_robustness_report_5b4bf195.json",
      "sha256": "",
      "template_id": "T11_robustness_report"
    },
    "T12_output_fairness_report": {
      "uri": "minio://eng-01_finclear_gmbh/phase_4/T12_output_fairness_report_624c383d.json",
      "sha256": "",
      "template_id": "T12_output_fairness_report"
    },
    "T13_output_sampling_log": {
      "uri": "minio://eng-01_finclear_gmbh/phase_4/T13_output_sampling_log_637a0489.json",
      "sha256": "",
      "template_id": "T13_output_sampling_log"
    },
    "T14_governance_findings": {
      "uri": "minio://eng-01_finclear_gmbh/phase_5/T14_governance_findings_726f10bc.json",
      "sha256": "",
      "template_id": "T14_governance_findings"
    },
    "T15_monitoring_logging_review": {
      "uri": "minio://eng-01_finclear_gmbh/phase_5/T15_monitoring_logging_review_bc8700c0.json",
      "sha256": "",
      "template_id": "T15_monitoring_logging_review"
    }
  },
  "compliance_matrix_ref": {
    "uri": "minio://eng-01_finclear_gmbh/phase_6/T17_compliance_matrix_2349711e.json",
    "sha256": "2349711e916987fde7816fbe9e528e8d97ebad137525fa02b5c074762b28a4b5",
    "template_id": "T17_compliance_matrix"
  },
  "blocking_findings": [
    {
      "finding_id": "P4-FAIR-PERSONAL_STATUS",
      "description": "Output fairness across 'personal_status' is PASS_WITH_OBSERVATIONS (disparate-impact ratio=0.914845, demographic-parity diff=0.16352201257861637).",
      "materiality": "possibly_material",
      "eu_ai_act_articles": [
        "Art.10\u00a72(f)",
        "Art.15\u00a71"
      ],
      "source_phase": "P4",
      "recommendation": "Investigate and mitigate the group disparity before deployment.",
      "control_id": null,
      "declared": null,
      "observed": null,
      "evidence_uris": [
        "minio://eng-01_finclear_gmbh/stage_a/T01a_stage_a_triage_63acd3d4.json",
        "minio://eng-01_finclear_gmbh/stage_b/T01b_annex_iv_dossier_4bf4baa3.json",
        "minio://eng-01_finclear_gmbh/stage_b/T01c_intake_completeness_report_a2daabc7.json",
        "minio://eng-01_finclear_gmbh/phase_1/T02_system_card_cb571a52.json",
        "minio://eng-01_finclear_gmbh/phase_1/T03_annex_iii_mapping_39d802ca.json",
        "minio://eng-01_finclear_gmbh/phase_1/T04_risk_tier_decision_cd66ff77.json",
        "minio://eng-01_finclear_gmbh/phase_1/T05_art43_decision_4c7af477.json",
        "minio://eng-01_finclear_gmbh/phase_2/T06_datasheet_for_datasets_04b4ed12.json",
        "minio://eng-01_finclear_gmbh/phase_2/T07_data_quality_report_e5abdeec.json",
        "minio://eng-01_finclear_gmbh/phase_2/T08_special_category_data_log_72d83953.json",
        "minio://eng-01_finclear_gmbh/phase_3/T09_model_card_7f94f22f.json",
        "minio://eng-01_finclear_gmbh/phase_3/T10_explainability_report_6ac1da8a.json",
        "minio://eng-01_finclear_gmbh/phase_3/T11_robustness_report_5b4bf195.json",
        "minio://eng-01_finclear_gmbh/phase_4/T12_output_fairness_report_624c383d.json",
        "minio://eng-01_finclear_gmbh/phase_4/T13_output_sampling_log_637a0489.json"
      ]
    },
    {
      "finding_id": "P4-FAIR-AGE",
      "description": "Output fairness across 'age' is FAIL (disparate-impact ratio=0.4, demographic-parity diff=1.0).",
      "materiality": "material",
      "eu_ai_act_articles": [
        "Art.10\u00a72(f)",
        "Art.15\u00a71"
      ],
      "source_phase": "P4",
      "recommendation": "Investigate and mitigate the group disparity before deployment.",
      "control_id": null,
      "declared": null,
      "observed": null,
      "evidence_uris": [
        "minio://eng-01_finclear_gmbh/stage_a/T01a_stage_a_triage_63acd3d4.json",
        "minio://eng-01_finclear_gmbh/stage_b/T01b_annex_iv_dossier_4bf4baa3.json",
        "minio://eng-01_finclear_gmbh/stage_b/T01c_intake_completeness_report_a2daabc7.json",
        "minio://eng-01_finclear_gmbh/phase_1/T02_system_card_cb571a52.json",
        "minio://eng-01_finclear_gmbh/phase_1/T03_annex_iii_mapping_39d802ca.json",
        "minio://eng-01_finclear_gmbh/phase_1/T04_risk_tier_decision_cd66ff77.json",
        "minio://eng-01_finclear_gmbh/phase_1/T05_art43_decision_4c7af477.json",
        "minio://eng-01_finclear_gmbh/phase_2/T06_datasheet_for_datasets_04b4ed12.json",
        "minio://eng-01_finclear_gmbh/phase_2/T07_data_quality_report_e5abdeec.json",
        "minio://eng-01_finclear_gmbh/phase_2/T08_special_category_data_log_72d83953.json",
        "minio://eng-01_finclear_gmbh/phase_3/T09_model_card_7f94f22f.json",
        "minio://eng-01_finclear_gmbh/phase_3/T10_explainability_report_6ac1da8a.json",
        "minio://eng-01_finclear_gmbh/phase_3/T11_robustness_report_5b4bf195.json",
        "minio://eng-01_finclear_gmbh/phase_4/T12_output_fairness_report_624c383d.json",